Results/pid_optimization_results.csv

Controller,Kp_values,Ki_values,Kd_values,RiseTime,SettlingTime,Overshoot,SteadyStateError,CostFunction
Manual PID,10,10,0.1,2.53230532242568,5.30321647257094,0,0.00116006968412563,5.19552157916124
PID Tuner,21.23,36.03,1.815,0.616135034366988,1.06780560800947,0.0346137787564649,5.78987968680167e-11,1.15176943544148
Optimized PID,27.323404111292,46.4528162625848,0.00100000001552466,0.296745332442296,0.444613737627539,1.85501870441647,8.49379344636247e-09,0.611831978822854

README.md

#### PID Tuner — Full Benchmark Configuration

Compared with the manually tuned PID controller, the optimized controller reduces the rise time from 2.5323 s to 0.2967 s and the settling time from 5.3032 s to 0.4446 s, while maintaining a nearly zero steady-state error.

Compared with the MATLAB PID Tuner, the optimized controller further reduces the rise time from 0.6161 s to 0.2967 s and the settling time from 1.0678 s to 0.4446 s. The overshoot increases slightly to 1.855%, which remains relatively low.